{"authority":"non-aws-prerequisite-evidence-only","claims":{"aws_authorized":false,"aws_execution_observed":false,"local_kata_qualification_passed":true,"promotion_authorized":false,"provider_execution_observed":false,"release_eligible":false},"control":{"head":"c72161b4a513b38c5d968e84d7fa440921b730da","result_schema_sha256":"57ff30b4adb601a7775dbefc9002c983152974ba3244aa449656c7e8a5f7dc27","static_control_sha256":"d94af3687d21c432946f3bb1bc40b76fc8dad786fea2cc51366d1651a8a33926","workflow_sha256":"70234e13f666384bd10a9deb569da14a40f504d0a9cbd18c1f5ffd9c2e24adb9"},"package_identity":{"deb_sha256":"08702b0d8605121987d29dd7e4941e87f0063776f20229e14c57529fd7d4ddcf","final_pin_sha256":"7dd03d3e4ef8ae7be1f76cefce3f704c86fb84765365a5eca0df437bf72e4d31","rootfs_sha256":"41951eee6ee10211fa716962dd6e2641c319a816b89d0fc31fe114872addc397"},"qualification":{"completed_at":"2026-08-31T14:27:32Z","conclusion":"success","event":"workflow_dispatch","first_created":true,"job_id":99488388424,"measurements":21,"receipt_artifact":{"archive_bytes":869,"archive_sha256":"bd736dbb38748a13e72d89dcf35833827c386545170bd54cc33bfe430ac78067","created_at":"2026-08-31T14:27:29Z","expires_at":"2026-09-07T14:27:29Z","id":9761868222,"member":"receipt.json","name":"stage2-local-kata-upload-receipt-1fc2dea2dcefea2aaf71a80356e0f5ed946e9991-c72161b4a513b38c5d968e84d7fa440921b730da-33392217934-1"},"report":{"bytes":8512,"path":"docs/security-evidence/stage2-local-kata-qualification-33392217934/report.json","qualified":true,"result":"pass","sha256":"443d09295da8300b486f4690a8256c344dd2c52eb95615b4c4474879e65e789c"},"report_artifact":{"archive_bytes":2024,"archive_sha256":"480870d8e4a0cea75fe4592a8d23e992e5d33cb58020adaf21a83337235d6074","created_at":"2026-08-31T14:27:28Z","expires_at":"2026-09-07T14:27:27Z","id":9761867397,"member":"report.json","name":"stage2-local-kata-report-1fc2dea2dcefea2aaf71a80356e0f5ed946e9991-c72161b4a513b38c5d968e84d7fa440921b730da-33392217934-1"},"run_attempt":1,"run_id":33392217934,"samples":7,"started_at":"2026-08-31T12:32:21Z","teardown_phases":13,"upload_receipt":{"bytes":1353,"path":"docs/security-evidence/stage2-local-kata-qualification-33392217934/upload-receipt.json","sha256":"cdff56d51848ca2236bbabb9c6f081ae483884cf2b0b55eb9e82f2dad278b25b"},"zero_residue_domains":37},"source":{"implementation_head":"1fc2dea2dcefea2aaf71a80356e0f5ed946e9991","manifest_sha256":"509dacc4a83b45a2da1ca7892210de8434a2b9de5b2a478ce4d8197f85967f3a"},"static_observation":{"artifact_digest":"22b10486248bb5ee9b7bf32ae8a0e2d8f08bbbe4f3fa526aff0db520e53faa7b","artifact_id":9742819865,"artifact_members":13,"run_attempt":1,"run_id":33348451013,"static_control_sha256":"d94af3687d21c432946f3bb1bc40b76fc8dad786fea2cc51366d1651a8a33926"},"terminal_gate":{"fresh_aws_authorization_required":true,"next_action":"stop-before-aws-and-request-fresh-authorization","prohibited_without_fresh_authorization":["aws-api","aws-credentials","provider","opentofu","ssm","inventory","deployment","campaign","production","release"]},"version":"cogs.stage2-pre-aws-qualification-package/v1"}
